"id","site","job_url","job_url_direct","title","company","location","date_posted","job_type","salary_source","interval","min_amount","max_amount","currency","is_remote","job_level","job_function","listing_type","emails","description","company_industry","company_url","company_logo","company_url_direct","company_addresses","company_num_employees","company_revenue","company_description","skills","experience_range","company_rating","company_reviews_count","vacancy_count","work_from_home_type"
"in-bd457ec80a816734","indeed","https://sg.indeed.com/viewjob?jk=bd457ec80a816734","https://ntu.wd3.myworkdayjobs.com/en-US/Careers/job/NTU-Main-Campus-Singapore/Project-Officer--Strategic-Collaboration-_R00023166","Project Officer (Strategic Collaboration)","Nanyang Technological University","SG","2026-01-19","fulltime","","","","","",False,"","","","","Centre for Climate Change and Environmental Health (CCEH) is a multidisciplinary research centre dedicated to understanding and mitigating the impacts of climate change on the environment and human health. The key objective is to investigate the driving mechanisms and develop effective solutions to safeguard ecosystem and human health in Southeast Asia. CCEH brings together leading experts in climate science, environmental engineering, and public health to tackle the region’s most pressing climate–health challenges through cutting-edge research, advanced modelling, and interdisciplinary collaboration. Through its integrative approach, CCEH aims to translate scientific insights into actionable strategies that promote sustainability, resilience, and well-being for current and future generations.

For more details, please view

https://www.ntu.edu.sg/cceh

.

We are looking for a Project Officer to support and coordinate a strategic collaboration between the Centre for Climate Change and Environmental Health (CCEH) and the WHO Asia Centre for Environment and Health (WHO ACE), including conference organization, report development, capacity-building activities, and administrative support for establishing a WHO Collaborating Centre at CCEH. The role will focus on planning and managing major CCEH-WHO joint events, coordinating multi-stakeholder scientific and policy reports, organizing regional training activities, supporting the WHO multi-city study, and ensuring smooth execution of tasks related to the WHO Collaborating Centre application.

Key Responsibilities:

* Coordinate major CCEH-WHO meetings, including logistics, agenda preparation, communications, and follow-up documentation.
* Assist in organizing regional capacity-building and training activities, including workshops and technical sessions tied to the major meetings.
* Provide project management support, including communication with partners, timeline tracking, and preparation of supporting materials.
* Facilitate communication and coordination among CCEH teams, WHO ACE staff, and external collaborators.
* Provide administrative and operational support to ensure the smooth execution of all CCEH-WHO collaboration activities.

Job Requirements:

* Bachelor’s degree in Public Health, Environmental Science, Geography, Public Policy, or related field.
* At least 1-3 years of relevant experience in project coordination, event management, research administration, or working with government/international organizations.
* Familiarity with environmental health, air quality, climate change, or public health-related projects will be an advantage.
* Good written and oral communication skills to prepare reports, meeting notes, and professional correspondence for multi-stakeholder audiences.
* Proficiency in common office software (e.g., MS Office, Excel, PowerPoint); experience with data compilation or document management is a plus.
* Competent in soft skills such as information organization, document preparation, and professional communication with diverse partners.

We regret to inform that only shortlisted candidates will be notified.

Hiring Institution: NTU","","https://sg.indeed.com/cmp/Nanyang-Technological-University","https://d2q79iu7y748jz.cloudfront.net/s/_squarelogo/256x256/8ac54b5b16e1e07cf13a72862bd86367","","Singapore","Decline to state","Decline to state","","","","","","",""
"in-f4e0910a3f06a662","indeed","https://sg.indeed.com/viewjob?jk=f4e0910a3f06a662","https://sggovterp.wd102.myworkdayjobs.com/en-US/PublicServiceCareers/job/MAS-MAS-Building/Advisor--Financial-Infrastructure---AI--BIS-Innovation-Hub--2-year-Contract-_JR-10000047081","Advisor, Financial Infrastructure & AI, BIS Innovation Hub (2-year Contract)","MAS Monetary Authority of Singapore","SG","2026-01-19","fulltime","","","","","",True,"","","","","**[What the role is]**

The Bank for International Settlements is a diverse, multicultural, and inclusive organization with colleagues from over 60 countries. Launched in 2019, the BIS innovation Hub (BISIH) is a group of centres located in the Nordics, the Euro area, Singapore, Hong Kong SAR, Canada, Switzerland, and the UK. Our mission is to identify and develop insights into critical trends in technology of relevance to central banks, explore the development of public goods to improve the functioning of the global financial system and serve as a focal point for a network of central bank authorities on innovation.
  
  
The scope of work includes identifying and executing new potential prototypes/ future systems that fit within the scope of the core thematic focus area of the BISIH – 1. Central Bank Digital Currency (CBDC); 2. New Payment Systems; 3. Open Finance, including through tokenisation and digital identity; 4. Green Finance, including the cross-over with bank supervision; 5. Suptech/Regtech; and 6. Cyber security, especially as linked to the foregoing.
  
  
This role is an MAS hire to be seconded to the BIS Innovation Hub in Singapore. The BISIH Singapore Centre is hosted in collaboration with the Monetary Authority of Singapore. By joining the Singapore Centre, you will help to shape the future of payments, money and finance. You will report to the Centre Head and work closely with the regional and global financial community.

**[What you will be working on]**

* Lead and develop prototypes that have the potential to be further developed into public goods for any of the core thematic focus areas

  + This involves the need for familiarity with the core functions of a central bank, including monetary policy, financial stability, supervisory functions and payment systems
  + An understanding of innovation environments and the need to apply creative thinking to solve problems and find solutions using new technologies
  + An understanding of Artificial Intelligence and its deployment and experience building or implementing algorithms relevant to banking and financial markets
* Building and working with a team and partners to scope, design and deliver innovative concepts including (but not limited to) areas in monetary policy, financial stability and payment systems
* Engaging and leading external delivery partners, working with them in crafting solutions for the centre’s projects and coordinate successful delivery of high quality outputs
* Working collaboratively with the other BIS Centres, hosted committees, regional and global central banks, and private sector stakeholders including banks, fintechs and payment service provides
* Representing the BIS at official meetings, industry and academic conferences and relevant technology events
* Contributing both verbal and written insights to the BISIH work programme and related events
* Establishing and develop contacts with private sector, the BIS committees, research communities and other international organisations

**[What we are looking for]**

* The ideal candidate will have very good understanding, exposure or direct experience in one or more of the functions of central banking and a passion for innovation
* Relevant work experience within technology consulting, the technology sector, central banking, financial services, or financial regulation
* Strong results orientation and outcome focus with the passion, drive, and energy to deliver
* Strong agile project management discipline. Practical experience in scoping, planning and leading projects with a track record of successful delivery
* Good knowledge of, exposure or hands-on experience with one or more of the core functions of central banking including monetary policy, financial stability, supervision and oversight, liquidity and reserves management or payment systems
* A knowledge of data science, the uses of Artificial Intelligence and Large Language Models in the contexts of central banking is an advantage
* Excellent interpersonal and communication skills as well as project planning, decision-making, problem-solving and analytical skills with an eye for detail
* Out of the box, creative and innovative thinking with an ability to see the bigger and interconnected picture, identifying solutions, opportunities, gaps, and potential risks
* Experience of working with and leading, face-to-face or remotely, third party project partners
* The ability to proactively perform in a fast paced, dynamic environment with teams with diverse and multicultural backgrounds – both face to face and remotely
* A desire to develop both individual and team capabilities, providing coaching and mentoring

This will be a 2-year contract. As part of the shortlisting process for this role, you may be required to complete a medical declaration and/or undergo further assessment.

All applicants will be notified on whether they are shortlisted or not within 4 weeks of the closing date of this job posting.","","https://sg.indeed.com/cmp/Mas-Monetary-Authority-of-Singapore","","","","","","","","","","","",""
"in-10c9a5452d71ceda","indeed","https://sg.indeed.com/viewjob?jk=10c9a5452d71ceda","https://ntu.wd3.myworkdayjobs.com/en-US/Careers/job/NTU-Main-Campus-Singapore/Research-Engineer-II--Engineering-Data-Science-Information-Systems-Statistics-Applied-Mathematics-_R00023161","Research Engineer II (Engineering/Data Science/Information Systems/Statistics/Applied Mathematics)","Nanyang Technological University","SG","2026-01-19","fulltime","","","","","",False,"","","","","The Alibaba-NTU Global e-Sustainability CorpLab (ANGEL) represents a key collaboration between Alibaba Group and Nanyang Technological University (NTU). Supported by the Singapore RIE2025 Fund, ANGEL creates and deploys impactful green digital technologies for global sustainability.

ANGEL’s mission aligns seamlessly with Singapore’s national objectives, such as the Singapore Green Plan 2030 and the Singapore Smart Nation Initiative. ANGEL’s work in developing sustainable and equitable digital solutions and promoting a sustainable and green lifestyle will contribute to a smaller carbon footprint. Its holistic approach will help to secure a brighter, more sustainable future for humanity.

ANGEL will also cultivate human talents equipped with both advanced technical skills and a solid understanding of sustainable practices. They will enable Singapore to realise its environmental and technological ambitions.

ANGEL is looking for a Research Engineer to support research work under the project “Green AI”.

Job Description:

* Work closely with the Principal Investigator (PI) and interdisciplinary team members to support applied research and development projects at the intersection of data, AI, and sustainability.
* Contribute to the development of practical frameworks, methodologies, or tools that translate research insights into deployable or industry-relevant solutions.
* Prepare technical reports, documentation, and presentations to communicate findings to both academic and industry stakeholders.
* Support collaboration with industry partners by aligning research objectives with practical constraints and business needs.

Job Requirements:

* Bachelor’s or Master’s degree in a quantitative or applied discipline (e.g., engineering, data science, information systems, operations research, statistics, applied mathematics, or related fields).
* Demonstrated experience working with industry partners or in industry–academia collaborative projects, including translating practical requirements into research or technical deliverables.
* Strong problem-solving skills, good communication abilities, and the capacity to work effectively in cross-functional and interdisciplinary teams.
* Prior experience contributing to technical reports, patents, white papers, or research publications is a plus, but not required.

We regret to inform that only shortlisted candidates will be notified.

Hiring Institution: NTU","","https://sg.indeed.com/cmp/Nanyang-Technological-University","https://d2q79iu7y748jz.cloudfront.net/s/_squarelogo/256x256/8ac54b5b16e1e07cf13a72862bd86367","","Singapore","Decline to state","Decline to state","","","","","","",""
"in-eb43c65696dd2e8e","indeed","https://sg.indeed.com/viewjob?jk=eb43c65696dd2e8e","https://JPMorganChase.contacthr.com/150684220","Global Banking Environmental & Social Due Diligence - Vice President","JPMorganChase","Downtown Core, S00, SG","2026-01-17","fulltime","","","","","",False,"","","","","**JOB DESCRIPTION**

J.P. Morgan’s Global Banking Environmental & Social Risk team has a responsibility for reviewing transactions within the Corporate and Investment Bank. With team members based in NYC, London, Bangalore, and Singapore, we offer comprehensive global coverage. The team's mandate is to safeguard the firm’s reputation by assessing in-scope transactions across a range of financial products, including equity and debt underwriting, loans, credit facilities, M&A activity, and sustainable finance products such as green, social, sustainable, and sustainability-linked loans and bonds. We cover sectors including power, metals and mining, oil and gas, and soft commodities.

As an Environmental & Social Risk Vice President within J.P. Morgan’s Global Banking Environmental & Social Risk team, you will review transactions within the Corporate and Investment Bank to ensure compliance with the firm’s Environmental and Social Risk (E&S) Policy Framework. You will partner with bankers, deal teams, and key stakeholders across the Global Banking franchise, providing advisory support and helping safeguard the firm’s reputation. This role requires a self-starter with strong communication and attention to detail, offering exposure to diverse E&S/ESG risks across multiple asset classes, industries, and geographies, and may involve limited travel.

**Job responsibilities**

* Evaluate environmental and social (E&S) requirements for relevant transactions.
* Analyze the E&S profile and performance of clients.
* Manage a small team of local and regional specialists.
* Advise bankers and deal teams, and support clients on E&S/ESG issues.
* Serve as an E&S subject matter expert and collaborate with internal stakeholders on E&S topics.
* Enhance training for bankers and deal teams in E&S risk assessment.
* Contribute to the team’s strategic planning, objectives, and key results.
* Engage with internal stakeholders to influence the firm’s broader E&S agenda.
* Stay informed on environmental issues affecting clients, including forestry, agriculture, climate change, carbon markets, energy efficiency, and renewable energy.

**Required qualifications, capabilities, and skills**

* Minimum 8 years of relevant experience in environmental and social risk/ESG/sustainability
* Bachelor's degree in environmental studies, sustainability, geography, development economics, finance, or a related field
* Strong understanding of banking products and decision-making processes.
* Understanding of sustainable finance regulations and market developments.
* Ability to convey information clearly, accurately, and succinctly, particularly to senior management audiences.
* Strong client focus and interpersonal skills.
* Commercial perspective on E&S issues.
* Ability to work under time pressure with flexibility to manage multiple tasks and adapt to changing priorities.
* Excellent working knowledge of the Equator Principles, IFC Performance Standards, WB EHS Guidelines, and other industry best practices for environmental and social risk management.
* Excellent working knowledge of LMA, LSTA, APMLA suite of sustainability principles (e.g., Sustainability Linked Loan Principles), guidance documents, EU Taxonomy, Climate Bonds Initiative Taxonomy, and other industry best practices for ESG.
* Strong analytical skills

**Preferred qualifications, capabilities, and skills**

* Minimum 8 years of relevant experience in environmental and social risk/ESG/sustainability, ideally within financial services, consultancy, or key sectors such as oil and gas, mining, power, and commodities.
* Proficiency in Mandarin to communicate with clients in China

**ABOUT US**  
  
J.P. Morgan is a global leader in financial services, providing strategic advice and products to the world’s most prominent corporations, governments, wealthy individuals and institutional investors. Our first-class business in a first-class way approach to serving clients drives everything we do. We strive to build trusted, long-term partnerships to help our clients achieve their business objectives.  

We recognize that our people are our strength and the diverse talents they bring to our global workforce are directly linked to our success. We are an equal opportunity employer and place a high value on diversity and inclusion at our company. We do not discriminate on the basis of any protected attribute, including race, religion, color, national origin, gender, sexual orientation, gender identity, gender expression, age, marital or veteran status, pregnancy or disability, or any other basis protected under applicable law. We also make reasonable accommodations for applicants’ and employees’ religious practices and beliefs, as well as mental health or physical disability needs. Visit our FAQs for more information about requesting an accommodation.

  
  
**ABOUT THE TEAM**  
  
J.P. Morgan’s Commercial & Investment Bank is a global leader across banking, markets, securities services and payments. Corporations, governments and institutions throughout the world entrust us with their business in more than 100 countries. The Commercial & Investment Bank provides strategic advice, raises capital, manages risk and extends liquidity in markets around the world.","","https://sg.indeed.com/cmp/Jpmorganchase-2","https://d2q79iu7y748jz.cloudfront.net/s/_squarelogo/256x256/62e186e96c7550325814ef6880fae379","https://www.jpmorganchase.com/","New York, NY","10,000+","more than $10B (USD)","Headquartered in New York City, JPMorgan Chase is the largest bank in the United States.","","","","","",""
"in-c7aaec2b64cf136b","indeed","https://sg.indeed.com/viewjob?jk=c7aaec2b64cf136b","https://jobs.ashbyhq.com/sofarocean/c24b3ddf-c181-44fd-b1a5-a56e2a6bf04c?utm_source=kJDD1ENG79","Sales Director, Spotter Hardware - APAC/Singapore","Sofar Ocean","Singapore, S00, SG","2026-01-15","fulltime","","","","","",True,"","","","","**The Company**
---------------

Sofar is the leading ocean intelligence platform. We’ve built the world’s largest real-time ocean network, turning billions of measurements into insights trusted by scientists, governments, and shipping fleets. Our technology makes the ocean more predictable and sustainable, helping customers save costs, cut emissions, and unlock insights that were once out of reach.

**The Role**
------------

* Responsible for executing Sofar’s GTM strategy for hardware and services sales to commercial accounts in the APAC region.
* Individually source and win smaller, transactional sales and ensure customer success to drive additional purchases
* Team with internal SMEs to target and win larger, strategic opportunities
* Influence the Product Team by providing customer/market feedback to inform roadmap
* Work with marketing to devise demand generation campaigns and materials for educating the market on Sofar’s products

**Impact You’ll Own:**
----------------------

* Develop and execute a strategic sales plan for the assigned territory, including regional partners.
* Lead the end-to-end sales process, including prospecting, qualification, proposal development, negotiation, and contract closure.
* Understand client needs deeply and position the Spotter’s unique value proposition effectively.
* Collaborate with internal teams (product, marketing, engineering) to align solutions with market demand and customer requirements.
* Work with and manage channel sales partners to develop business in new regions.
* Represent Sofar at industry events, conferences, and networking opportunities in the region.

**About You**
-------------

* 6+ year history of achieving or exceeding revenue targets in a technical hardware sales role, preferably in maritime, environmental tech, or related industries.
* Familiarity with / comfort with scientific instrumentation, either from a previous sales role or from field experience in oceanography, environmental science, ecology, environmental chemistry, etc.
* Demonstrated ability to grow and manage a sales pipeline of both transactional and complex, multi-stakeholder sales
* Excellent communication, negotiation, and interpersonal skills.
* Self-starter with the ability to work independently and collaboratively in a fast-paced environment.
* Willingness to travel as needed to meet clients and attend events.

### **Bonus Points**

* Experience presenting a highly configurable product-set as an integrated platform
* Deep passion for the Ocean
* Familiarity with Hubspot CRM

**Sofar's Commitment to Climate Justice**
-----------------------------------------

We at Sofar Ocean acknowledge that careers in the marine sciences “... have traditionally been, and remain, non-diverse work environments”, thereby limiting the entry and prosperity of underrepresented groups in the space. (**Johri et al.**, 2021) Many of these same groups are disproportionately affected by climate change, and are often excluded from decision making that directly address their interests and needs.

We are committed to addressing these climate injustices and highly encourage people who identify as women, LGBTQ+, Black, Indigenous, and people of color (BIPOC) to apply","","https://sg.indeed.com/cmp/Sofar-Ocean","","","","","","","","","","","",""
